{
  "version": 1,
  "note": "音の通り道。amb_（鳴り続ける環境音）は ambience のバス、se_（シナリオの効果音）と ui_（返事の音）は se のバス。バスの音量は設定の画面の値を Controls.mixerOf が掛ける。panel = 窓（ログ・栞・設定）を開いている間の聞こえ方（環境音を籠もらせる）。",
  "defaultBus": "se",
  "transitionSeconds": 0.4,
  "buses": [
    { "name": "ambience", "volume": 0.7, "lowpassGainHF": 1.0 },
    { "name": "se", "volume": 0.8, "lowpassGainHF": 1.0 }
  ],
  "routes": [
    { "bus": "ambience", "prefixes": ["amb_"] },
    { "bus": "se", "prefixes": ["se_", "ui_"] }
  ],
  "ducks": [
    { "bus": "ambience", "by": ["se"], "depth": 0.75, "attackSeconds": 0.05, "holdSeconds": 0.2, "releaseSeconds": 0.6 }
  ],
  "cooldowns": [ { "prefix": "ui_cursor", "seconds": 0.04 } ],
  "snapshots": [ { "name": "panel", "buses": [ { "name": "ambience", "lowpassGainHF": 0.25 } ] } ]
}
